{
    "$schema": "http://json-schema.org/draft-07/schema#",
    "$id": "http://json-schema.org/draft-07/schema#",
    "title": "needs.json schema",
    "type": "object",
    "properties": {
        "created": {"type": "string"},
        "current_version": {"type": "string"},
        "project": {"type": "string"},
        "versions":  {
            "type": "object",
             "patternProperties": {
                 "^.*$": {
                     "type": "object",
                     "properties": {
                         "created": {"type": "string"},
                         "creator": {"type": "object"},
                         "needs": {
                             "patternProperties": {
                                 "^.*$": {
                                     "type": "object",
                                     "properties": {
                                         "title": {"type": "string"},
                                         "id": {"type": "string"},
                                         "content": {"type": "string"},
                                         "type": {"type": "string"},
                                         "status": {"type": "string"},
                                         "tags": {"type": "string"},
                                         "links": {"type": "string"},
                                         "extends": {"type": "string"},
                                         "includes": {"type": "string"},
                                         "associates": {"type": "string"},
                                         "priority": {"type": "string"},
                                         "element_type": {"type": "string"},
                                         "vp_model_id": {"type": "string"}
                                     }
                                 }
                             }
                         },
                         "needs_amount": {"type": "number"}
                     }
                 }
             },
             "additionalProperties": false
        }
    },
    "required": ["current_version", "project"]
}
